Detailed Report,County,State,Municipality,Permitted Uses,Mentions of Moratoria,Sentiment,Sentiment Detail,Recent Projects
https://app.sparkhq.ai/reports?location=737,Clay County,SD,,,No mentions of moratoria,MIXED,"- **Recent regulatory development**: Clay County has just implemented a new solar ordinance in 2024, showing willingness to accommodate solar energy development. - **Community concerns**: There is significant opposition from preservation advocates regarding setbacks near Spirit Mound Historic Prairie, with requests for larger setbacks than what was approved. - **Balanced approach**: The county demonstrates a methodical approach to energy development by incorporating public input and establishing comprehensive regulations while still moving forward with allowing projects.",
https://app.sparkhq.ai/reports?location=887,Bon Homme County,SD,,,Mentions moratoria,MIXED,"- **Project approval with opposition**: While the Prevailing Wind Park project was ultimately approved, there was significant community opposition regarding noise, health risks, and property values. - **Local governance support**: County officials and boards generally supported the project, reducing fees and granting permits, showing institutional backing. - **Community division**: Strong evidence of split community sentiment, with some residents advocating for stricter setbacks and others highlighting economic benefits.",
https://app.sparkhq.ai/reports?location=896,Codington County,SD,,,Mentions moratoria,GOOD,"- **Strong regulatory framework**: Codington County has comprehensive wind energy ordinances and is actively developing solar ordinances, showing support for renewable energy development. - **Track record of approvals**: Multiple large wind projects have been approved, including Crowned Ridge Wind I & II and Dakota Range Wind Project, demonstrating consistent support for energy development. - **Proactive development**: The county is considering new energy projects like battery storage facilities and has shown interest in expanding renewable energy infrastructure through various initiatives.",
https://app.sparkhq.ai/reports?location=897,Grant County,SD,,,Mentions moratoria,GOOD,"- **Multiple approved projects**: The county has approved several major wind projects including Crowned Ridge Wind (300MW), Dakota Range (302.4MW), and Dakota Range III (151.2MW), showing consistent support for renewable energy. - **Proactive regulations**: Grant County has established comprehensive zoning ordinances for both solar and wind energy systems, demonstrating a structured approach to renewable development. - **Economic benefits emphasized**: Local officials consistently highlight the economic advantages of energy projects, including job creation, tax revenues, and landowner payments, indicating positive reception of renewable energy development.",
https://app.sparkhq.ai/reports?location=944,Hyde County,SD,,,No mentions of moratoria,GOOD,"- **Strong regulatory support**: Multiple wind projects have been approved by the South Dakota PUC, including North Bend Wind Project and Triple H Wind Project, showing consistent regulatory backing. - **Significant investment and development**: Major projects like the $285M North Bend Wind Project and $300M Triple H Wind Project demonstrate substantial commitment to renewable energy. - **Positive community engagement**: Local farmers have expressed support for wind projects, citing economic benefits through lease payments and improved infrastructure maintenance.",
https://app.sparkhq.ai/reports?location=1241,Campbell County,SD,,,No mentions of moratoria,MIXED,"- **Recent approvals with conditions**: County approved two conditional use permits for wind farm development in November 2024, but tabled noise variance requests due to concerns. - **Historical controversy**: Previous wind farm phases faced significant opposition from landowners regarding inadequate regulations and zoning ordinances. - **Economic benefits vs. community concerns**: While there's support from economic development board and evidence of tax benefits, persistent concerns exist about noise levels, property values, and insufficient protective regulations.","Campbell County Wind Farm 2, LLC (4/24/2025): WAPA approved an interconnection request for Campbell County Wind Farm 2, allowing construction of a 29-turbine wind farm with associated infrastructure. The project received a Finding of No Significant Impact (FONSI), clearing the way for development.; Link: https://www.energy.gov/sites/default/files/2025-04/fonsi-ea-2062-campbell-county-wind-farm-2-2025-04.pdf; Campbell County Wind Farm 2, LLC (10/31/2024): Sound modeling assessment completed for the 100 MW wind power facility, confirming compliance with local noise limits of 45 dBA at nonparticipating structures. The project will consist of 29 GE Sierra 140 turbines on agricultural land in Campbell County, South Dakota.; Link: https://www.wapa.gov/wp-content/uploads/2025/04/508_AppH_Campbell-County-Wind-Sound-Modeling-November-18-2024_PDFA.pdf; Campbell County Wind Farm 2, LLC (7/31/2024): Initial Environmental Assessment draft released for the proposed 29-turbine wind farm, including plans for access roads, collection substation, and underground electrical systems, with focus on environmental compliance and impact assessment.; Link: https://www.wapa.gov/wp-content/uploads/2024/08/Campbell-County-Wind-Farm-2-Final-Draft-Environmental-Assessment-1.pdf"
https://app.sparkhq.ai/reports?location=1729,Brookings County,SD,,,Mentions moratoria,GOOD,"- **Multiple approved projects**: Brookings County has approved several major energy projects including wind farms (Buffalo Ridge II, Tatanka Ridge), solar farms (Brookings Solar Project), and battery storage facilities (Cloverleaf Battery Project). - **Supportive regulations**: The county has established comprehensive wind energy and commercial ordinances that explicitly allow and regulate renewable energy development. - **Recent approvals**: The county continues to approve new energy projects, with recent permits granted for a 5MW solar facility and a 175MW battery storage system in 2024.","NextEra Energy Resources (11/5/2024): Proposed lithium-ion battery storage system near Waverly, South Dakota, aimed at stabilizing the local power grid and providing cheaper electricity. The project has raised some safety concerns from local residents due to its proximity to homes.; Link: https://www.thepublicopinion.com/story/news/2024/11/06/lithium-ion-battery-plant-might-open-near-watertown/76051602007/; Spearmint Energy (9/22/2024): Development of the Cloverleaf Battery Project in White, SD - a 175-megawatt battery storage facility designed to store excess energy from renewable sources and enhance grid stability.; Link: https://brookingsregister.com/stories/battery-project-powering-up-near-white,98995; MRES (9/12/2024): Approval of the Brookings Solar Project - a 5-megawatt solar facility that will power approximately 1,100 homes annually, with construction planned to begin in fall and complete by late 2025.; Link: https://www.mrenergy.com/news/mres-receives-conditional-use-permit-for-brookings-solar-project"
https://app.sparkhq.ai/reports?location=2353,Douglas County,SD,,,No mentions of moratoria,GOOD,"- **Proactive Regulation**: County has recently passed Ordinance No. 2024-01 specifically to include Solar Energy Systems as a conditional use. - **Clear Framework**: The ordinance provides detailed definitions and guidelines for solar energy development, showing commitment to facilitating these projects. - **Public Engagement**: County actively encourages community involvement in the planning process, demonstrating a balanced approach to renewable energy development.",
https://app.sparkhq.ai/reports?location=2637,Minnehaha County,SD,,,Mentions moratoria,MIXED,"- **Initial support but later opposition**: While the county approved solar ordinances in 2014 and initially supported projects, a major solar project was ultimately denied due to community opposition. - **Regulatory framework exists**: The county has established zoning regulations for Solar Energy Conversion Systems (SECS) and allows them as conditional uses in multiple districts. - **Community division**: There's evident tension between policy support and local resistance, with NIMBY concerns about aesthetics and property values affecting project approvals.",
https://app.sparkhq.ai/reports?location=3055,Pennington County,SD,,,Mentions moratoria,MIXED,- **Recent success**: County approved and completed the large Wild Springs Solar Project (128MW) in early 2024 - **Growing opposition**: 95% of residents expressed disapproval of solar installations in agricultural areas in mid-2025 - **Regulatory uncertainty**: County implemented a one-year moratorium on new wind/solar projects in late 2024 to review regulations,
https://app.sparkhq.ai/reports?location=3186,Yankton County,SD,,,Mentions moratoria,MIXED,"- **Recent regulatory development**: County is actively working on solar ordinances and has approved wind projects, showing willingness to accommodate renewable energy. - **Strong public opposition**: Significant community resistance to the Swan Lake Wind Project, with many residents expressing concerns at public meetings. - **Balanced approach**: County is implementing careful regulations and permits for both solar and wind projects, indicating neither full support nor complete opposition.","NextEra Energy Resources, LLC (10/8/2024): Swan Lake Wind Project - 248 MW wind farm with 97 turbines planned in South Dakota, currently undergoing Environmental Assessment; Link: https://www.wapa.gov/about-wapa/regions/ugp/environment/swan-lake-wind-project-doe-ea-2248; Swan Lake Wind, LLC (8/13/2024): Wind energy project facing strong public opposition and legal concerns regarding permit application, with decision postponed for further review; Link: https://www.yankton.net/community/article_d81fbd04-59ec-11ef-b8a9-bfcf1321d6ae.html"
https://app.sparkhq.ai/reports?location=3222,Union County,SD,,,Mentions moratoria,,,
https://app.sparkhq.ai/reports?location=3615,Beadle County,SD,,,Mentions moratoria,GOOD,"- **Supportive Infrastructure**: The city actively encourages solar installations by simplifying the permitting process. - **Large-Scale Development**: A significant 200MW wind facility project is being planned, showing openness to major renewable energy developments. - **Economic Integration**: The area demonstrates commitment through infrastructure investment and promoting economic benefits like job creation and property value increases.",
https://app.sparkhq.ai/reports?location=3645,Deuel County,SD,,,Mentions moratoria,GOOD,"- **Strong local support**: Multiple wind projects have been approved in Deuel County, including the recent $621M South Deuel Wind Project with 68 turbines, showing consistent regulatory backing. - **Economic benefits**: Projects bring significant economic advantages with millions in tax revenue and landowner payments ($78M in landowner payments, $38M in tax revenue for South Deuel project alone). - **Established track record**: County has successfully hosted several operational wind farms including Deuel Harvest North, Crowned Ridge II, and Tatanka Ridge, demonstrating a positive history with energy development.","Invenergy (3/5/2025): Large-scale wind project approved in South Dakota with 68 turbines, valued at $621 million. Project will generate 260 megawatts and provide significant economic benefits including $78M in landowner payments and $38M in tax revenue over 30 years.; Link: https://southdakotaagconnection.com/news/south-dakota-approves-new-wind-farm-project; Invenergy (3/4/2025): South Dakota Public Utilities Commission approved a 260 MW wind farm, one of the largest in the state. Project includes over 50 environmental conditions and will create 243 construction jobs plus 8 permanent positions.; Link: https://electrek.co/2025/03/04/south-dakota-largest-wind-farms-green-light/; Invenergy (3/2/2025): South Deuel Wind Project received approval for construction of up to 68 wind turbines. The project will generate $118 million in combined local tax revenue and landowner lease payments over its operational lifespan.; Link: https://www.sdpb.org/business-economics/2025-03-03/puc-approves-261-million-wind-farm-project-in-deuel-county"
https://app.sparkhq.ai/reports?location=3711,Roberts County,SD,,,Mentions moratoria,GOOD,"- **Strong regulatory support**: Roberts County adopted Wind Energy Systems ordinance in 2017, showing proactive support for wind energy development. - **Successful project approval**: The Dakota Range III wind project received approval from the Public Utilities Commission with strong community support. - **Multiple renewable projects**: The area has a history of supporting renewable energy, including the Summit Wind Farm and potential battery storage projects.",
https://app.sparkhq.ai/reports?location=3897,Clark County,SD,,,No mentions of moratoria,MIXED,"- **Initial opposition and regulatory challenges**: Clark County initially imposed restrictive setback requirements and faced legal challenges from developers, showing early resistance. - **Eventual approval and success**: Despite early challenges, multiple renewable projects were approved including the 400MW Crocker Wind Farm and Wild Springs Solar Project. - **Community concerns persist**: Ongoing tensions between developers and locals regarding setbacks, noise concerns, and environmental impacts indicate mixed acceptance of energy projects.",
https://app.sparkhq.ai/reports?location=3898,Charles Mix County,SD,,,No mentions of moratoria,MIXED,"- **Project approval with opposition**: While the Prevailing Wind Park project received approval and permits, there were significant local concerns and legal complaints about noise levels and safety measures. - **Economic benefits vs community concerns**: Despite offering substantial economic benefits through tax revenue and jobs, residents voiced strong concerns about health impacts, noise pollution, and visual disturbance. - **Regulatory compliance**: The region shows willingness to approve energy projects but implements strict regulations and oversight, including specific noise limits and setback requirements.",
https://app.sparkhq.ai/reports?location=3899,Hutchinson County,SD,,,Mentions moratoria,MIXED,"- **Mixed community response**: While the project received approval and support from local authorities, there were significant concerns from residents about noise pollution, health impacts, and visual disturbance. - **Project approval with conditions**: The Prevailing Wind Park project was approved but with strict conditions regarding setbacks, noise levels, and environmental compliance. - **Economic benefits vs local opposition**: Despite strong economic benefits including tax revenue and landowner payments, some locals protested preferential treatment and raised concerns about property values.",
https://app.sparkhq.ai/reports?location=3900,Hand County,SD,,,No mentions of moratoria,GOOD,"- **Multiple approved projects**: Hand County has approved several major wind projects including the 200MW Sweetland Wind Farm and the Titan Wind Farm, showing strong support for renewable energy. - **Supportive regulations**: The county has established comprehensive wind energy ordinances that provide clear guidelines for development while protecting local interests. - **Economic benefits welcomed**: Local authorities have embraced renewable projects for their economic benefits, including job creation and tax revenue generation of over $35 million from the Sweetland project alone.",
https://app.sparkhq.ai/reports?location=5096,Edmunds County,SD,,,No mentions of moratoria,,,
https://app.sparkhq.ai/reports?location=5514,Tripp County,SD,,,No mentions of moratoria,GOOD,"- Multiple large-scale wind farm projects (100MW and 99MW) have been proposed and studied for development in the area. - Project development teams have conducted thorough site evaluations and found favorable conditions for wind energy. - Financial analyses show positive economic viability, suggesting a supportive environment for renewable energy development.",
https://app.sparkhq.ai/reports?location=5515,Hughes County,SD,,,Mentions moratoria,MIXED,"- **Recent project approvals**: County has approved major wind projects like North Bend Wind, showing openness to renewable energy development. - **History of moratoriums**: Previously implemented temporary moratoriums on wind projects to review regulations, indicating cautious approach. - **Community division**: Significant community debate exists, with some supporting projects for economic benefits while others oppose due to agricultural and infrastructure concerns.",
https://app.sparkhq.ai/reports?location=5563,Fall River County,SD,,,Mentions moratoria,GOOD,"- **Multiple approved projects**: County has approved and successfully developed several large solar projects including Fall River Solar (80MW) and Wild Springs Solar (128MW). - **Supportive regulatory environment**: County commissioners and PUC consistently work to facilitate solar development through approvals and dispute resolution. - **No opposition**: No evidence of local protests, moratoriums, or restrictive zoning against solar development.","Broad Reach Power, Greenbacker Renewable Energy (10/20/2024): Fall River Solar PV Park - 80MW solar power project in South Dakota. Will generate enough electricity to power 17,747 households and offset about 148,548 tons of CO2 emissions annually. Expected commissioning in December 2024.; Link: https://www.power-technology.com/data-insights/power-plant-profile-fall-river-solar-pv-park-us/"
https://app.sparkhq.ai/reports?location=5568,Oglala Lakota County,SD,,,Mentions moratoria,GOOD,"- **Strong regulatory support**: The South Dakota PUC approved the first large-scale solar facility permit for the Lookout Solar Project, demonstrating clear support for renewable energy development. - **Positive community engagement**: The project received backing from tribal authorities and local communities, with focus on job creation and economic benefits for the region. - **Multiple project approvals**: The region has shown consistent support for renewable energy through approval of multiple projects, including both solar and wind facilities, indicating an encouraging environment for energy development.",
https://app.sparkhq.ai/reports?location=5570,Brown County,SD,,,Mentions moratoria,GOOD,"- **Recent Approval**: Brown County adopted Ordinance #256 in October 2023 specifically regulating solar energy systems, showing proactive support for renewable energy. - **Active Development**: Invenergy is currently planning a 250MW wind farm in the Frederick area, indicating openness to large-scale renewable projects. - **Regulatory Framework**: Multiple jurisdictions (Aberdeen City and Brown County) have established or are developing ordinances for both wind and solar energy systems, demonstrating institutional support.",
https://app.sparkhq.ai/reports?location=5574,Butte County,SD,,,Mentions moratoria,GOOD,"- **Strong regulatory support**: Butte County approved a comprehensive wind farm ordinance in 2015, demonstrating clear support for renewable energy development. - **Successful project history**: Multiple wind projects have been approved and completed, including the $210 million Willow Creek Wind Energy Facility. - **Limited opposition**: While there was some initial community opposition in 2015, it did not prevent project approvals, and subsequent projects have moved forward successfully.",
https://app.sparkhq.ai/reports?location=5579,Spink County,SD,,,No mentions of moratoria,GOOD,"- **Multiple solar projects**: County has several solar projects in various stages of development, including a 60MW Tulare Energy project and an 8.25MW RE Solar project, showing consistent support for renewable energy. - **Favorable zoning regulations**: Planning and Zoning Board confirmed solar farms are permitted uses in commercial zones and discussed developing specific solar regulations, indicating institutional support. - **Mixed-use approach**: Projects incorporate agricultural benefits like grazing and pollinator-friendly vegetation, showing thoughtful integration of solar development with existing land uses.",
https://app.sparkhq.ai/reports?location=5582,Custer County,SD,,,Mentions moratoria,GOOD,"- **Strong local support**: Multiple approvals from county commissions and tribal authorities, with minimal opposition noted across sources. - **Economic benefits**: Project promises significant job creation (200+ jobs) and economic development in one of the state's poorest counties. - **Regulatory progress**: Successfully obtained necessary permits and approvals, showing positive regulatory environment for energy development.",
https://app.sparkhq.ai/reports?location=5589,Meade County,SD,,,Mentions moratoria,GOOD,"- **Active Development**: Multiple large-scale solar projects are being proposed and considered in Meade County, including a 1,100-acre solar plant and a 200MW solar farm project. - **Supportive Regulations**: The county has established clear wind energy ordinances and is actively working on solar ordinances, showing regulatory support for renewable energy. - **Positive Economic Impact**: Local authorities recognize the economic benefits of renewable energy projects, including tax revenue, job creation, and stable income for landowners.",
https://app.sparkhq.ai/reports?location=5591,Stanley County,SD,,,No mentions of moratoria,GOOD,"- **Clear regulatory framework**: County has established comprehensive wind energy ordinance showing willingness to accommodate renewable energy. - **Structured approval process**: Allows wind energy systems through Conditional Use Permits in agricultural areas with clear guidelines. - **Forward-thinking approach**: Includes detailed provisions for environmental protection and decommissioning, indicating thoughtful integration of energy development.",
https://app.sparkhq.ai/reports?location=5594,McPherson County,SD,,,No mentions of moratoria,MIXED,- **Recent wind farm development**: Active development of the Leola Wind Farm (400MW) and engagement with zoning amendments shows openness to wind energy. - **Regulatory concerns**: Imposed moratorium on battery energy storage and strict setback requirements for solar farms indicate cautious approach. - **Political uncertainty**: Recent discussions about potential moratoriums and significant community opposition suggest growing resistance to renewable energy projects.,
https://app.sparkhq.ai/reports?location=5600,Bennett County,SD,,,No mentions of moratoria,GOOD,"- Project has been selected for development after thorough site evaluation, indicating county's openness to wind energy. - No mention of local opposition or regulatory hurdles in the project planning. - County was specifically chosen for its logistical advantages, suggesting favorable development conditions.",
https://app.sparkhq.ai/reports?location=5604,Corson County,SD,,,,,,
https://app.sparkhq.ai/reports?location=5608,Haakon County,SD,,,No mentions of moratoria,GOOD,"- **Active Development Progress**: Multiple environmental assessments and interconnection studies are underway, showing strong institutional support and forward momentum for the Philip Wind Project. - **Community Benefits Emphasis**: Project documentation highlights significant economic benefits including 200 construction jobs and millions in tax revenues for local infrastructure. - **Regulatory Compliance**: The project is actively working with federal and local agencies, completing necessary environmental studies, and implementing protective measures for wildlife.","Philip Wind Partners, LLC (4/30/2025): Major interconnection project for a 300 MW wind facility connecting to WAPA's 230-kV transmission line, including comprehensive environmental assessments and wildlife protection measures; Link: https://www.wapa.gov/wp-content/uploads/2025/05/Philip-Wind-Final-EA-WAPA_508.pdf; Invenergy (1/31/2025): Philip Wind Energy Center development project promising clean energy generation, 200 construction jobs, and significant economic benefits through local tax revenues; Link: https://philipwind.invenergy.com; Philip Wind Partners, LLC (10/14/2024): 91-turbine wind project development with 300 MW capacity, including detailed wildlife impact studies and conservation measures for endangered species; Link: https://www.wapa.gov/wp-content/uploads/2025/05/Appendix-P_Philip-Wind-BBCS_Not-508.pdf"
https://app.sparkhq.ai/reports?location=5611,Perkins County,SD,,,Mentions moratoria,GOOD,"- **Project Approval**: The detailed development report indicates the project has received necessary approvals and permits for wind energy development. - **Infrastructure Support**: The area has favorable conditions including accessibility and existing transmission lines that support energy development. - **Environmental Compliance**: The project demonstrates thorough environmental considerations and wildlife protection measures, indicating a balanced approach to energy development.",
